name,area,description,detail,image_url,image_urls,lat,lon,tags,is_indoor,weather_ok,price,opening_hours,weather_sutability,highlights
高牟神社,imaike,都会の中にひっそり佇む、静かで落ち着いた雰囲気の神社,名古屋の中心部にありながら、境内に一歩入ると空気が変わるような静けさを感じられる神社。木々に囲まれた境内は、日常の喧騒を忘れて心を整えたいときにぴったりだよ。散歩の途中や気分転換にも立ち寄りやすく、ゆったりとした時間を過ごせる場所。,/imaike/i1-1.png,"/imaike/i1-1.png,/imaike/i1-2.png",35.1682,136.9326,relax,FALSE,FALSE,無料,なし,晴れ：散策や外出のついでに立ち寄りやすい｜くもり：散策や外出のついでに立ち寄りやすい｜雨：雰囲気は楽しめるが、足元には注意が必要,"都会にあるとは思えない静かな空間,気軽に立ち寄れて心をリセットできる"
HAPUNA CAFFEE,imaike,落ち着いた空間で、ゆったり過ごせる大人向けカフェ,シンプルで洗練された店内が印象的なカフェ。コーヒーを楽しみながら、ひとり時間や作業、友人との会話まで幅広く使えるよ。静かすぎず騒がしすぎない、ちょうどいい居心地の良さが魅力。,/imaike/i2-1.png,"/imaike/i2-1.png,/imaike/i2-2.png,/imaike/i2-3.png",35.1657,136.9303,cafe,TRUE,TRUE,1000円〜1999円,09:00-18:30/火定休日,晴れ：落ち着いて食事を楽しめる｜くもり：落ち着いて食事を楽しめる｜雨：屋内なので天気を気にせず利用できる,"落ち着いた雰囲気で長居しやすい,天気に左右されず使いやすいカフェ"
BURGERS REPUBLIC,imaike,本格バーガーを気軽に楽しめる、満足度の高いハンバーガー店,肉厚なパティとボリューム感のあるバンズが特徴のハンバーガー専門店。シンプルながら素材の旨みをしっかり感じられ、がっつり食べたい日にぴったりだよ。一人でも入りやすく、ランチにも使いやすいお店。,/imaike/i3-1.png,"/imaike/i3-1.png,/imaike/i3-2.png,/imaike/i3-3.png",35.1649,136.9318,food,TRUE,TRUE,1000円〜1999円,10:00-19:00/水定休日,晴れ：落ち着いて食事を楽しめる｜くもり：落ち着いて食事を楽しめる｜雨：屋内なので天気を気にせず利用できる,"肉感しっかりの本格バーガー,一人でも入りやすい雰囲気"
今池公園,imaike,今池エリアで気軽に立ち寄れる、街中の小さな公園。,住宅街と街並みに囲まれた、落ち着いた雰囲気の公園。ベンチで一息ついたり、散歩の途中に立ち寄ったりと日常使いしやすい場所だよ。都会の中で少しだけ自然を感じたいときにちょうどいい。,/imaike/i4-1.png,"/imaike/i4-1.png,/imaike/i4-2.png",35.1674,136.9342,slow,FALSE,FALSE,無料,なし,晴れ：散策や外出のついでに立ち寄りやすい｜くもり：散策や外出のついでに立ち寄りやすい｜雨：屋外中心のため、やや利用しにくい,"今池エリアで気軽に休憩できる,散歩や気分転換にちょうどいいサイズ感"
ピカイチ,imaike,名古屋で長く愛される、活気ある町中華の名店。,地元客に長年支持されている、ボリューム満点の中華料理店。メニューが豊富で、何度行っても楽しめるのが魅力。友人同士でも一人でも入りやすく、しっかり食べたい日におすすめ。,/imaike/i5-1.png,"/imaike/i5-1.png,/imaike/i5-2.png,/imaike/i5-3.png",35.1678,136.9348,food,TRUE,TRUE,1000円〜1999円,平日18:00~24:00(L.O.23:30) 土・祝17:30~24:00(L.O.23:30)/日定休日,晴れ：落ち着いて食事を楽しめる｜くもり：落ち着いて食事を楽しめる｜雨：屋内なので天気を気にせず利用できる,"メニュー豊富で飽きない,ボリュームがあり満足感が高い"
PARADIZE CAFE 21,imaike,今池で落ち着いて過ごせる、居心地のいいレトロカフェ。,どこか懐かしさを感じる雰囲気が魅力のカフェ。コーヒーを飲みながらゆっくり過ごしたり、ひとり時間を楽しむのにちょうどいい。今池散策の合間の休憩スポットとしても使いやすいお店。,/imaike/i6-1.png,"/imaike/i6-1.png,/imaike/i6-2.png",35.1671,136.9333,cafe,TRUE,TRUE,4000円〜4999円,09:00~23:00,晴れ：落ち着いて食事を楽しめる｜くもり：落ち着いて食事を楽しめる｜雨：屋内なので天気を気にせず利用できる,"落ち着いた雰囲気で長居しやすい,一人でも入りやすいカフェ"
西今池公園,imaike,今池エリアにある、静かで使いやすい街中公園。,住宅街に囲まれた、落ち着いた雰囲気の小さな公園。ベンチもあり、散歩の途中や少し休みたいときに便利。人が多すぎず、のんびり過ごせるのが魅力。,/imaike/i7-1.png,"/imaike/i7-1.png,/imaike/i7-2.png",35.1701,136.931,slow,FALSE,FALSE,無料,なし,晴れ：散策や外出のついでに立ち寄りやすい｜くもり：散策や外出のついでに立ち寄りやすい｜雨：屋外中心のため、やや利用しにくい,"静かで落ち着いた空間,今池散策の合間に使いやすい"